{
  "standardVersion": "1.0.0",
  "tableId": "nested-headers-table",
  "sourceDocumentId": "doc-survey-results",
  "sourceFileName": "survey-analysis.pdf",
  "title": "Customer Satisfaction Survey Results",
  "caption": "Two-level nested headers grouping scores by category and sub-metric.",
  "sectionPath": ["Survey", "Detailed Results"],
  "notes": ["Level-0 groups span multiple columns; level-1 labels map to individual columns."],
  "pages": [7],
  "columns": [
    { "colIndex": 0, "label": "Segment" },
    { "colIndex": 1, "label": "Score", "units": "1–10" },
    { "colIndex": 2, "label": "Responses", "units": "count" },
    { "colIndex": 3, "label": "Score", "units": "1–10" },
    { "colIndex": 4, "label": "Responses", "units": "count" },
    { "colIndex": 5, "label": "Score", "units": "1–10" },
    { "colIndex": 6, "label": "Responses", "units": "count" },
    { "colIndex": 7, "label": "Overall NPS" }
  ],
  "headerGroups": [
    { "groupId": "hg-product", "label": "Product", "level": 0, "colStart": 1, "colEnd": 2 },
    { "groupId": "hg-support", "label": "Support", "level": 0, "colStart": 3, "colEnd": 4 },
    { "groupId": "hg-delivery", "label": "Delivery", "level": 0, "colStart": 5, "colEnd": 6 },
    { "groupId": "hg-segment-l1", "label": "Segment", "level": 1, "colStart": 0, "colEnd": 0 },
    { "groupId": "hg-product-score-l1", "label": "Score", "level": 1, "colStart": 1, "colEnd": 1 },
    { "groupId": "hg-product-resp-l1", "label": "Responses", "level": 1, "colStart": 2, "colEnd": 2 },
    { "groupId": "hg-support-score-l1", "label": "Score", "level": 1, "colStart": 3, "colEnd": 3 },
    { "groupId": "hg-support-resp-l1", "label": "Responses", "level": 1, "colStart": 4, "colEnd": 4 },
    { "groupId": "hg-delivery-score-l1", "label": "Score", "level": 1, "colStart": 5, "colEnd": 5 },
    { "groupId": "hg-delivery-resp-l1", "label": "Responses", "level": 1, "colStart": 6, "colEnd": 6 },
    { "groupId": "hg-nps-l1", "label": "Overall NPS", "level": 1, "colStart": 7, "colEnd": 7 }
  ],
  "rows": [
    { "rowIndex": 0, "rowType": "header", "cellIds": ["h0","h1","h2","h3","h4","h5","h6","h7"], "page": 7 },
    { "rowIndex": 1, "rowType": "body", "cellIds": ["r1c0","r1c1","r1c2","r1c3","r1c4","r1c5","r1c6","r1c7"], "page": 7 },
    { "rowIndex": 2, "rowType": "body", "cellIds": ["r2c0","r2c1","r2c2","r2c3","r2c4","r2c5","r2c6","r2c7"], "page": 7 },
    { "rowIndex": 3, "rowType": "body", "cellIds": ["r3c0","r3c1","r3c2","r3c3","r3c4","r3c5","r3c6","r3c7"], "page": 7 },
    { "rowIndex": 4, "rowType": "body", "cellIds": ["r4c0","r4c1","r4c2","r4c3","r4c4","r4c5","r4c6","r4c7"], "page": 7 }
  ],
  "cells": [
    { "cellId": "h0", "rowIndex": 0, "colIndex": 0, "textRaw": "Segment", "textNormalized": "Segment", "isHeader": true, "headerLevel": 1, "page": 7 },
    { "cellId": "h1", "rowIndex": 0, "colIndex": 1, "textRaw": "Product / Score", "textNormalized": "Product / Score", "isHeader": true, "headerLevel": 1, "inferredHeaders": ["Product"], "page": 7 },
    { "cellId": "h2", "rowIndex": 0, "colIndex": 2, "textRaw": "Product / Responses", "textNormalized": "Product / Responses", "isHeader": true, "headerLevel": 1, "inferredHeaders": ["Product"], "page": 7 },
    { "cellId": "h3", "rowIndex": 0, "colIndex": 3, "textRaw": "Support / Score", "textNormalized": "Support / Score", "isHeader": true, "headerLevel": 1, "inferredHeaders": ["Support"], "page": 7 },
    { "cellId": "h4", "rowIndex": 0, "colIndex": 4, "textRaw": "Support / Responses", "textNormalized": "Support / Responses", "isHeader": true, "headerLevel": 1, "inferredHeaders": ["Support"], "page": 7 },
    { "cellId": "h5", "rowIndex": 0, "colIndex": 5, "textRaw": "Delivery / Score", "textNormalized": "Delivery / Score", "isHeader": true, "headerLevel": 1, "inferredHeaders": ["Delivery"], "page": 7 },
    { "cellId": "h6", "rowIndex": 0, "colIndex": 6, "textRaw": "Delivery / Responses", "textNormalized": "Delivery / Responses", "isHeader": true, "headerLevel": 1, "inferredHeaders": ["Delivery"], "page": 7 },
    { "cellId": "h7", "rowIndex": 0, "colIndex": 7, "textRaw": "Overall NPS", "textNormalized": "Overall NPS", "isHeader": true, "headerLevel": 0, "page": 7 },
    { "cellId": "r1c0", "rowIndex": 1, "colIndex": 0, "textRaw": "Enterprise", "textNormalized": "Enterprise", "page": 7 },
    { "cellId": "r1c1", "rowIndex": 1, "colIndex": 1, "textRaw": "8.4", "textNormalized": "8.4", "valueType": "number", "units": "1–10", "page": 7 },
    { "cellId": "r1c2", "rowIndex": 1, "colIndex": 2, "textRaw": "312", "textNormalized": "312", "valueType": "number", "units": "count", "page": 7 },
    { "cellId": "r1c3", "rowIndex": 1, "colIndex": 3, "textRaw": "7.9", "textNormalized": "7.9", "valueType": "number", "units": "1–10", "page": 7 },
    { "cellId": "r1c4", "rowIndex": 1, "colIndex": 4, "textRaw": "298", "textNormalized": "298", "valueType": "number", "units": "count", "page": 7 },
    { "cellId": "r1c5", "rowIndex": 1, "colIndex": 5, "textRaw": "8.1", "textNormalized": "8.1", "valueType": "number", "units": "1–10", "page": 7 },
    { "cellId": "r1c6", "rowIndex": 1, "colIndex": 6, "textRaw": "304", "textNormalized": "304", "valueType": "number", "units": "count", "page": 7 },
    { "cellId": "r1c7", "rowIndex": 1, "colIndex": 7, "textRaw": "+42", "textNormalized": "+42", "valueType": "number", "page": 7 },
    { "cellId": "r2c0", "rowIndex": 2, "colIndex": 0, "textRaw": "Mid-Market", "textNormalized": "Mid-Market", "page": 7 },
    { "cellId": "r2c1", "rowIndex": 2, "colIndex": 1, "textRaw": "7.6", "textNormalized": "7.6", "valueType": "number", "units": "1–10", "page": 7 },
    { "cellId": "r2c2", "rowIndex": 2, "colIndex": 2, "textRaw": "541", "textNormalized": "541", "valueType": "number", "units": "count", "page": 7 },
    { "cellId": "r2c3", "rowIndex": 2, "colIndex": 3, "textRaw": "8.2", "textNormalized": "8.2", "valueType": "number", "units": "1–10", "page": 7 },
    { "cellId": "r2c4", "rowIndex": 2, "colIndex": 4, "textRaw": "519", "textNormalized": "519", "valueType": "number", "units": "count", "page": 7 },
    { "cellId": "r2c5", "rowIndex": 2, "colIndex": 5, "textRaw": "7.3", "textNormalized": "7.3", "valueType": "number", "units": "1–10", "page": 7 },
    { "cellId": "r2c6", "rowIndex": 2, "colIndex": 6, "textRaw": "508", "textNormalized": "508", "valueType": "number", "units": "count", "page": 7 },
    { "cellId": "r2c7", "rowIndex": 2, "colIndex": 7, "textRaw": "+31", "textNormalized": "+31", "valueType": "number", "page": 7 },
    { "cellId": "r3c0", "rowIndex": 3, "colIndex": 0, "textRaw": "SMB", "textNormalized": "SMB", "page": 7 },
    { "cellId": "r3c1", "rowIndex": 3, "colIndex": 1, "textRaw": "6.9", "textNormalized": "6.9", "valueType": "number", "units": "1–10", "page": 7 },
    { "cellId": "r3c2", "rowIndex": 3, "colIndex": 2, "textRaw": "1204", "textNormalized": "1204", "valueType": "number", "units": "count", "page": 7 },
    { "cellId": "r3c3", "rowIndex": 3, "colIndex": 3, "textRaw": "7.1", "textNormalized": "7.1", "valueType": "number", "units": "1–10", "page": 7 },
    { "cellId": "r3c4", "rowIndex": 3, "colIndex": 4, "textRaw": "1189", "textNormalized": "1189", "valueType": "number", "units": "count", "page": 7 },
    { "cellId": "r3c5", "rowIndex": 3, "colIndex": 5, "textRaw": "7.8", "textNormalized": "7.8", "valueType": "number", "units": "1–10", "page": 7 },
    { "cellId": "r3c6", "rowIndex": 3, "colIndex": 6, "textRaw": "1196", "textNormalized": "1196", "valueType": "number", "units": "count", "page": 7 },
    { "cellId": "r3c7", "rowIndex": 3, "colIndex": 7, "textRaw": "+18", "textNormalized": "+18", "valueType": "number", "page": 7 },
    { "cellId": "r4c0", "rowIndex": 4, "colIndex": 0, "textRaw": "Consumer", "textNormalized": "Consumer", "page": 7 },
    { "cellId": "r4c1", "rowIndex": 4, "colIndex": 1, "textRaw": "7.2", "textNormalized": "7.2", "valueType": "number", "units": "1–10", "page": 7 },
    { "cellId": "r4c2", "rowIndex": 4, "colIndex": 2, "textRaw": "3892", "textNormalized": "3892", "valueType": "number", "units": "count", "page": 7 },
    { "cellId": "r4c3", "rowIndex": 4, "colIndex": 3, "textRaw": "6.8", "textNormalized": "6.8", "valueType": "number", "units": "1–10", "page": 7 },
    { "cellId": "r4c4", "rowIndex": 4, "colIndex": 4, "textRaw": "3741", "textNormalized": "3741", "valueType": "number", "units": "count", "page": 7 },
    { "cellId": "r4c5", "rowIndex": 4, "colIndex": 5, "textRaw": "8.3", "textNormalized": "8.3", "valueType": "number", "units": "1–10", "page": 7 },
    { "cellId": "r4c6", "rowIndex": 4, "colIndex": 6, "textRaw": "3801", "textNormalized": "3801", "valueType": "number", "units": "count", "page": 7 },
    { "cellId": "r4c7", "rowIndex": 4, "colIndex": 7, "textRaw": "+24", "textNormalized": "+24", "valueType": "number", "page": 7 }
  ],
  "provenance": [
    { "step": "fixture-authoring", "tool": "manual", "version": "1.0.0", "timestamp": "2026-04-18T00:00:00Z" }
  ]
}
