{
  "standardVersion": "1.0.0",
  "tableId": "repeated-headers-table",
  "sourceDocumentId": "doc-inventory-2025",
  "sourceFileName": "inventory-report.pdf",
  "title": "Inventory Levels by SKU",
  "caption": "Multi-page inventory table with repeated header row on continuation page.",
  "sectionPath": ["Inventory", "SKU Detail"],
  "notes": ["Header row repeated on page 2 is marked repeatedHeaderRow:true and excluded from logical data rows."],
  "pages": [11, 12],
  "pageSpans": [{ "page": 11 }, { "page": 12 }],
  "columns": [
    { "colIndex": 0, "label": "SKU" },
    { "colIndex": 1, "label": "Description" },
    { "colIndex": 2, "label": "Warehouse" },
    { "colIndex": 3, "label": "Qty On Hand" },
    { "colIndex": 4, "label": "Reorder Level" },
    { "colIndex": 5, "label": "Unit Cost", "units": "USD" }
  ],
  "rows": [
    { "rowIndex": 0, "rowType": "header", "cellIds": ["h0","h1","h2","h3","h4","h5"], "page": 11 },
    { "rowIndex": 1, "rowType": "body", "cellIds": ["r1c0","r1c1","r1c2","r1c3","r1c4","r1c5"], "page": 11 },
    { "rowIndex": 2, "rowType": "body", "cellIds": ["r2c0","r2c1","r2c2","r2c3","r2c4","r2c5"], "page": 11 },
    { "rowIndex": 3, "rowType": "body", "cellIds": ["r3c0","r3c1","r3c2","r3c3","r3c4","r3c5"], "page": 11 },
    { "rowIndex": 4, "rowType": "header", "cellIds": ["rh0","rh1","rh2","rh3","rh4","rh5"], "page": 12, "repeatedHeaderRow": true },
    { "rowIndex": 5, "rowType": "body", "cellIds": ["r5c0","r5c1","r5c2","r5c3","r5c4","r5c5"], "page": 12 },
    { "rowIndex": 6, "rowType": "body", "cellIds": ["r6c0","r6c1","r6c2","r6c3","r6c4","r6c5"], "page": 12 }
  ],
  "cells": [
    { "cellId": "h0", "rowIndex": 0, "colIndex": 0, "textRaw": "SKU", "textNormalized": "SKU", "isHeader": true, "page": 11 },
    { "cellId": "h1", "rowIndex": 0, "colIndex": 1, "textRaw": "Description", "textNormalized": "Description", "isHeader": true, "page": 11 },
    { "cellId": "h2", "rowIndex": 0, "colIndex": 2, "textRaw": "Warehouse", "textNormalized": "Warehouse", "isHeader": true, "page": 11 },
    { "cellId": "h3", "rowIndex": 0, "colIndex": 3, "textRaw": "Qty On Hand", "textNormalized": "Qty On Hand", "isHeader": true, "page": 11 },
    { "cellId": "h4", "rowIndex": 0, "colIndex": 4, "textRaw": "Reorder Level", "textNormalized": "Reorder Level", "isHeader": true, "page": 11 },
    { "cellId": "h5", "rowIndex": 0, "colIndex": 5, "textRaw": "Unit Cost (USD)", "textNormalized": "Unit Cost (USD)", "isHeader": true, "page": 11 },
    { "cellId": "r1c0", "rowIndex": 1, "colIndex": 0, "textRaw": "SKU-001", "textNormalized": "SKU-001", "page": 11 },
    { "cellId": "r1c1", "rowIndex": 1, "colIndex": 1, "textRaw": "Widget Alpha", "textNormalized": "Widget Alpha", "page": 11 },
    { "cellId": "r1c2", "rowIndex": 1, "colIndex": 2, "textRaw": "WH-East", "textNormalized": "WH-East", "page": 11 },
    { "cellId": "r1c3", "rowIndex": 1, "colIndex": 3, "textRaw": "1240", "textNormalized": "1240", "valueType": "number", "page": 11 },
    { "cellId": "r1c4", "rowIndex": 1, "colIndex": 4, "textRaw": "200", "textNormalized": "200", "valueType": "number", "page": 11 },
    { "cellId": "r1c5", "rowIndex": 1, "colIndex": 5, "textRaw": "$12.50", "textNormalized": "12.50", "valueType": "currency", "units": "USD", "page": 11 },
    { "cellId": "r2c0", "rowIndex": 2, "colIndex": 0, "textRaw": "SKU-002", "textNormalized": "SKU-002", "page": 11 },
    { "cellId": "r2c1", "rowIndex": 2, "colIndex": 1, "textRaw": "Widget Beta", "textNormalized": "Widget Beta", "page": 11 },
    { "cellId": "r2c2", "rowIndex": 2, "colIndex": 2, "textRaw": "WH-West", "textNormalized": "WH-West", "page": 11 },
    { "cellId": "r2c3", "rowIndex": 2, "colIndex": 3, "textRaw": "580", "textNormalized": "580", "valueType": "number", "page": 11 },
    { "cellId": "r2c4", "rowIndex": 2, "colIndex": 4, "textRaw": "150", "textNormalized": "150", "valueType": "number", "page": 11 },
    { "cellId": "r2c5", "rowIndex": 2, "colIndex": 5, "textRaw": "$8.75", "textNormalized": "8.75", "valueType": "currency", "units": "USD", "page": 11 },
    { "cellId": "r3c0", "rowIndex": 3, "colIndex": 0, "textRaw": "SKU-003", "textNormalized": "SKU-003", "page": 11 },
    { "cellId": "r3c1", "rowIndex": 3, "colIndex": 1, "textRaw": "Gadget Gamma", "textNormalized": "Gadget Gamma", "page": 11 },
    { "cellId": "r3c2", "rowIndex": 3, "colIndex": 2, "textRaw": "WH-Central", "textNormalized": "WH-Central", "page": 11 },
    { "cellId": "r3c3", "rowIndex": 3, "colIndex": 3, "textRaw": "92", "textNormalized": "92", "valueType": "number", "page": 11 },
    { "cellId": "r3c4", "rowIndex": 3, "colIndex": 4, "textRaw": "100", "textNormalized": "100", "valueType": "number", "page": 11 },
    { "cellId": "r3c5", "rowIndex": 3, "colIndex": 5, "textRaw": "$34.00", "textNormalized": "34.00", "valueType": "currency", "units": "USD", "page": 11 },
    { "cellId": "rh0", "rowIndex": 4, "colIndex": 0, "textRaw": "SKU", "textNormalized": "SKU", "isHeader": true, "page": 12 },
    { "cellId": "rh1", "rowIndex": 4, "colIndex": 1, "textRaw": "Description", "textNormalized": "Description", "isHeader": true, "page": 12 },
    { "cellId": "rh2", "rowIndex": 4, "colIndex": 2, "textRaw": "Warehouse", "textNormalized": "Warehouse", "isHeader": true, "page": 12 },
    { "cellId": "rh3", "rowIndex": 4, "colIndex": 3, "textRaw": "Qty On Hand", "textNormalized": "Qty On Hand", "isHeader": true, "page": 12 },
    { "cellId": "rh4", "rowIndex": 4, "colIndex": 4, "textRaw": "Reorder Level", "textNormalized": "Reorder Level", "isHeader": true, "page": 12 },
    { "cellId": "rh5", "rowIndex": 4, "colIndex": 5, "textRaw": "Unit Cost (USD)", "textNormalized": "Unit Cost (USD)", "isHeader": true, "page": 12 },
    { "cellId": "r5c0", "rowIndex": 5, "colIndex": 0, "textRaw": "SKU-004", "textNormalized": "SKU-004", "page": 12 },
    { "cellId": "r5c1", "rowIndex": 5, "colIndex": 1, "textRaw": "Component Delta", "textNormalized": "Component Delta", "page": 12 },
    { "cellId": "r5c2", "rowIndex": 5, "colIndex": 2, "textRaw": "WH-East", "textNormalized": "WH-East", "page": 12 },
    { "cellId": "r5c3", "rowIndex": 5, "colIndex": 3, "textRaw": "3400", "textNormalized": "3400", "valueType": "number", "page": 12 },
    { "cellId": "r5c4", "rowIndex": 5, "colIndex": 4, "textRaw": "500", "textNormalized": "500", "valueType": "number", "page": 12 },
    { "cellId": "r5c5", "rowIndex": 5, "colIndex": 5, "textRaw": "$2.10", "textNormalized": "2.10", "valueType": "currency", "units": "USD", "page": 12 },
    { "cellId": "r6c0", "rowIndex": 6, "colIndex": 0, "textRaw": "SKU-005", "textNormalized": "SKU-005", "page": 12 },
    { "cellId": "r6c1", "rowIndex": 6, "colIndex": 1, "textRaw": "Module Epsilon", "textNormalized": "Module Epsilon", "page": 12 },
    { "cellId": "r6c2", "rowIndex": 6, "colIndex": 2, "textRaw": "WH-West", "textNormalized": "WH-West", "page": 12 },
    { "cellId": "r6c3", "rowIndex": 6, "colIndex": 3, "textRaw": "720", "textNormalized": "720", "valueType": "number", "page": 12 },
    { "cellId": "r6c4", "rowIndex": 6, "colIndex": 4, "textRaw": "250", "textNormalized": "250", "valueType": "number", "page": 12 },
    { "cellId": "r6c5", "rowIndex": 6, "colIndex": 5, "textRaw": "$18.90", "textNormalized": "18.90", "valueType": "currency", "units": "USD", "page": 12 }
  ],
  "continuity": {
    "isMultiPage": true,
    "logicalTableGroupId": "inventory-sku-detail",
    "continuedFromPreviousPage": false,
    "continuesOnNextPage": false
  },
  "provenance": [
    { "step": "fixture-authoring", "tool": "manual", "version": "1.0.0", "timestamp": "2026-04-18T00:00:00Z" }
  ]
}
