{
  "standardVersion": "1.0.0",
  "tableId": "wide-table",
  "sourceDocumentId": "doc-performance-matrix",
  "sourceFileName": "benchmark-report.pdf",
  "title": "System Performance Benchmark Matrix",
  "caption": "Multi-metric comparison across 10 system configurations.",
  "sectionPath": ["Benchmarks", "Full Matrix"],
  "notes": ["Wide tables with 10+ columns fall back to structured text in Markdown export."],
  "pages": [8],
  "columns": [
    { "colIndex": 0, "label": "System" },
    { "colIndex": 1, "label": "CPU", "units": "GHz" },
    { "colIndex": 2, "label": "RAM", "units": "GB" },
    { "colIndex": 3, "label": "Disk", "units": "GB" },
    { "colIndex": 4, "label": "Read IOPS", "units": "K/s" },
    { "colIndex": 5, "label": "Write IOPS", "units": "K/s" },
    { "colIndex": 6, "label": "Net Throughput", "units": "Mbps" },
    { "colIndex": 7, "label": "Latency P50", "units": "ms" },
    { "colIndex": 8, "label": "Latency P99", "units": "ms" },
    { "colIndex": 9, "label": "Power Draw", "units": "W" },
    { "colIndex": 10, "label": "Score" }
  ],
  "rows": [
    { "rowIndex": 0, "rowType": "header", "cellIds": ["h0","h1","h2","h3","h4","h5","h6","h7","h8","h9","h10"], "page": 8 },
    { "rowIndex": 1, "rowType": "body", "cellIds": ["r1c0","r1c1","r1c2","r1c3","r1c4","r1c5","r1c6","r1c7","r1c8","r1c9","r1c10"], "page": 8 },
    { "rowIndex": 2, "rowType": "body", "cellIds": ["r2c0","r2c1","r2c2","r2c3","r2c4","r2c5","r2c6","r2c7","r2c8","r2c9","r2c10"], "page": 8 },
    { "rowIndex": 3, "rowType": "body", "cellIds": ["r3c0","r3c1","r3c2","r3c3","r3c4","r3c5","r3c6","r3c7","r3c8","r3c9","r3c10"], "page": 8 }
  ],
  "cells": [
    { "cellId": "h0", "rowIndex": 0, "colIndex": 0, "textRaw": "System", "textNormalized": "System", "isHeader": true, "page": 8 },
    { "cellId": "h1", "rowIndex": 0, "colIndex": 1, "textRaw": "CPU (GHz)", "textNormalized": "CPU (GHz)", "isHeader": true, "page": 8 },
    { "cellId": "h2", "rowIndex": 0, "colIndex": 2, "textRaw": "RAM (GB)", "textNormalized": "RAM (GB)", "isHeader": true, "page": 8 },
    { "cellId": "h3", "rowIndex": 0, "colIndex": 3, "textRaw": "Disk (GB)", "textNormalized": "Disk (GB)", "isHeader": true, "page": 8 },
    { "cellId": "h4", "rowIndex": 0, "colIndex": 4, "textRaw": "Read IOPS (K/s)", "textNormalized": "Read IOPS (K/s)", "isHeader": true, "page": 8 },
    { "cellId": "h5", "rowIndex": 0, "colIndex": 5, "textRaw": "Write IOPS (K/s)", "textNormalized": "Write IOPS (K/s)", "isHeader": true, "page": 8 },
    { "cellId": "h6", "rowIndex": 0, "colIndex": 6, "textRaw": "Net (Mbps)", "textNormalized": "Net (Mbps)", "isHeader": true, "page": 8 },
    { "cellId": "h7", "rowIndex": 0, "colIndex": 7, "textRaw": "P50 (ms)", "textNormalized": "P50 (ms)", "isHeader": true, "page": 8 },
    { "cellId": "h8", "rowIndex": 0, "colIndex": 8, "textRaw": "P99 (ms)", "textNormalized": "P99 (ms)", "isHeader": true, "page": 8 },
    { "cellId": "h9", "rowIndex": 0, "colIndex": 9, "textRaw": "Power (W)", "textNormalized": "Power (W)", "isHeader": true, "page": 8 },
    { "cellId": "h10", "rowIndex": 0, "colIndex": 10, "textRaw": "Score", "textNormalized": "Score", "isHeader": true, "page": 8 },
    { "cellId": "r1c0", "rowIndex": 1, "colIndex": 0, "textRaw": "Alpha-1", "textNormalized": "Alpha-1", "page": 8 },
    { "cellId": "r1c1", "rowIndex": 1, "colIndex": 1, "textRaw": "3.6", "textNormalized": "3.6", "valueType": "number", "units": "GHz", "page": 8 },
    { "cellId": "r1c2", "rowIndex": 1, "colIndex": 2, "textRaw": "64", "textNormalized": "64", "valueType": "number", "units": "GB", "page": 8 },
    { "cellId": "r1c3", "rowIndex": 1, "colIndex": 3, "textRaw": "2000", "textNormalized": "2000", "valueType": "number", "units": "GB", "page": 8 },
    { "cellId": "r1c4", "rowIndex": 1, "colIndex": 4, "textRaw": "450", "textNormalized": "450", "valueType": "number", "units": "K/s", "page": 8 },
    { "cellId": "r1c5", "rowIndex": 1, "colIndex": 5, "textRaw": "380", "textNormalized": "380", "valueType": "number", "units": "K/s", "page": 8 },
    { "cellId": "r1c6", "rowIndex": 1, "colIndex": 6, "textRaw": "10000", "textNormalized": "10000", "valueType": "number", "units": "Mbps", "page": 8 },
    { "cellId": "r1c7", "rowIndex": 1, "colIndex": 7, "textRaw": "1.2", "textNormalized": "1.2", "valueType": "number", "units": "ms", "page": 8 },
    { "cellId": "r1c8", "rowIndex": 1, "colIndex": 8, "textRaw": "4.8", "textNormalized": "4.8", "valueType": "number", "units": "ms", "page": 8 },
    { "cellId": "r1c9", "rowIndex": 1, "colIndex": 9, "textRaw": "320", "textNormalized": "320", "valueType": "number", "units": "W", "page": 8 },
    { "cellId": "r1c10", "rowIndex": 1, "colIndex": 10, "textRaw": "8742", "textNormalized": "8742", "valueType": "number", "page": 8 },
    { "cellId": "r2c0", "rowIndex": 2, "colIndex": 0, "textRaw": "Beta-2", "textNormalized": "Beta-2", "page": 8 },
    { "cellId": "r2c1", "rowIndex": 2, "colIndex": 1, "textRaw": "4.2", "textNormalized": "4.2", "valueType": "number", "units": "GHz", "page": 8 },
    { "cellId": "r2c2", "rowIndex": 2, "colIndex": 2, "textRaw": "128", "textNormalized": "128", "valueType": "number", "units": "GB", "page": 8 },
    { "cellId": "r2c3", "rowIndex": 2, "colIndex": 3, "textRaw": "4000", "textNormalized": "4000", "valueType": "number", "units": "GB", "page": 8 },
    { "cellId": "r2c4", "rowIndex": 2, "colIndex": 4, "textRaw": "820", "textNormalized": "820", "valueType": "number", "units": "K/s", "page": 8 },
    { "cellId": "r2c5", "rowIndex": 2, "colIndex": 5, "textRaw": "710", "textNormalized": "710", "valueType": "number", "units": "K/s", "page": 8 },
    { "cellId": "r2c6", "rowIndex": 2, "colIndex": 6, "textRaw": "25000", "textNormalized": "25000", "valueType": "number", "units": "Mbps", "page": 8 },
    { "cellId": "r2c7", "rowIndex": 2, "colIndex": 7, "textRaw": "0.8", "textNormalized": "0.8", "valueType": "number", "units": "ms", "page": 8 },
    { "cellId": "r2c8", "rowIndex": 2, "colIndex": 8, "textRaw": "3.1", "textNormalized": "3.1", "valueType": "number", "units": "ms", "page": 8 },
    { "cellId": "r2c9", "rowIndex": 2, "colIndex": 9, "textRaw": "480", "textNormalized": "480", "valueType": "number", "units": "W", "page": 8 },
    { "cellId": "r2c10", "rowIndex": 2, "colIndex": 10, "textRaw": "9315", "textNormalized": "9315", "valueType": "number", "page": 8 },
    { "cellId": "r3c0", "rowIndex": 3, "colIndex": 0, "textRaw": "Gamma-3", "textNormalized": "Gamma-3", "page": 8 },
    { "cellId": "r3c1", "rowIndex": 3, "colIndex": 1, "textRaw": "2.8", "textNormalized": "2.8", "valueType": "number", "units": "GHz", "page": 8 },
    { "cellId": "r3c2", "rowIndex": 3, "colIndex": 2, "textRaw": "32", "textNormalized": "32", "valueType": "number", "units": "GB", "page": 8 },
    { "cellId": "r3c3", "rowIndex": 3, "colIndex": 3, "textRaw": "500", "textNormalized": "500", "valueType": "number", "units": "GB", "page": 8 },
    { "cellId": "r3c4", "rowIndex": 3, "colIndex": 4, "textRaw": "180", "textNormalized": "180", "valueType": "number", "units": "K/s", "page": 8 },
    { "cellId": "r3c5", "rowIndex": 3, "colIndex": 5, "textRaw": "150", "textNormalized": "150", "valueType": "number", "units": "K/s", "page": 8 },
    { "cellId": "r3c6", "rowIndex": 3, "colIndex": 6, "textRaw": "1000", "textNormalized": "1000", "valueType": "number", "units": "Mbps", "page": 8 },
    { "cellId": "r3c7", "rowIndex": 3, "colIndex": 7, "textRaw": "2.5", "textNormalized": "2.5", "valueType": "number", "units": "ms", "page": 8 },
    { "cellId": "r3c8", "rowIndex": 3, "colIndex": 8, "textRaw": "9.2", "textNormalized": "9.2", "valueType": "number", "units": "ms", "page": 8 },
    { "cellId": "r3c9", "rowIndex": 3, "colIndex": 9, "textRaw": "180", "textNormalized": "180", "valueType": "number", "units": "W", "page": 8 },
    { "cellId": "r3c10", "rowIndex": 3, "colIndex": 10, "textRaw": "6201", "textNormalized": "6201", "valueType": "number", "page": 8 }
  ],
  "provenance": [
    { "step": "fixture-authoring", "tool": "manual", "version": "1.0.0", "timestamp": "2026-04-18T00:00:00Z" }
  ]
}
